"standard_element_id","standard_id","version","formal_status","namespace","class_or_property","human_label","normative_definition","domain","range","cardinality","controlled_vocabulary","normative_or_informative","validation_artifact","intended_capability","known_limit","source_pinpoint"
"EL-CROISSANT-Dataset-distribution","STD-CROISSANT-1.1","1.1","COMMUNITY_SPEC — MLCommons specification","http://schema.org/","schema:distribution","dataset distribution resources","A Croissant dataset requires one or more distribution values typed as cr:FileObject or cr:FileSet.","schema:Dataset","cr:FileObject or cr:FileSet","1..*","NOT_APPLICABLE","NORMATIVE","REFERENCE_IMPLEMENTATION_VALIDATOR; no normative SHACL identified","Enumerate files and file collections forming the ML dataset package.","Declared resources may still be unavailable altered unauthorized or incompletely described.","Croissant 1.1 §Dataset-level Information — Modified and Added Properties; §Resources"
"EL-CROISSANT-FileObject","STD-CROISSANT-1.1","1.1","COMMUNITY_SPEC — MLCommons specification","http://mlcommons.org/croissant/","cr:FileObject","File Object","The Croissant class for an individual dataset file and a subclass of schema:DataDownload.","NOT_APPLICABLE","NOT_APPLICABLE","NOT_APPLICABLE","NOT_APPLICABLE","NORMATIVE","REFERENCE_IMPLEMENTATION_VALIDATOR; no normative SHACL identified","Represent downloadable files with URL size format and optional checksum.","File metadata does not prove content integrity unless the checksum is present verified and tied to the retrieved bytes.","Croissant 1.1 §Resources — FileObject"
"EL-CROISSANT-FileSet","STD-CROISSANT-1.1","1.1","COMMUNITY_SPEC — MLCommons specification","http://mlcommons.org/croissant/","cr:FileSet","File Set","A collection of homogeneous files in a container optionally selected by inclusion and exclusion patterns.","NOT_APPLICABLE","NOT_APPLICABLE","NOT_APPLICABLE","NOT_APPLICABLE","NORMATIVE","REFERENCE_IMPLEMENTATION_VALIDATOR; no normative SHACL identified","Represent archive or directory contents as dataset resources.","Pattern evaluation describes package layout but not semantic completeness or legal admissibility.","Croissant 1.1 §Resources — FileSet"
"EL-CROISSANT-RecordSet","STD-CROISSANT-1.1","1.1","COMMUNITY_SPEC — MLCommons specification","http://mlcommons.org/croissant/","cr:RecordSet","Record Set","A set of structured records obtained from one or more sources with structure expressed as fields.","NOT_APPLICABLE","NOT_APPLICABLE","NOT_APPLICABLE","NOT_APPLICABLE","NORMATIVE","REFERENCE_IMPLEMENTATION_VALIDATOR; no normative SHACL identified","Describe record-level structure across tabular nested and unstructured modalities.","A RecordSet description need not prove full data coverage or accurate source extraction.","Croissant 1.1 §RecordSets — RecordSet"
"EL-CROISSANT-Field","STD-CROISSANT-1.1","1.1","COMMUNITY_SPEC — MLCommons specification","http://mlcommons.org/croissant/","cr:Field","Field","A component of a RecordSet representing a table column or nested data structure.","NOT_APPLICABLE","NOT_APPLICABLE","NOT_APPLICABLE","NOT_APPLICABLE","NORMATIVE","REFERENCE_IMPLEMENTATION_VALIDATOR; no normative SHACL identified","Represent variables features labels and nested elements with sources and datatypes.","Field metadata does not establish statistical properties sensitivity or legal relevance.","Croissant 1.1 §RecordSets — Field"
"EL-CROISSANT-DataSource","STD-CROISSANT-1.1","1.1","COMMUNITY_SPEC — MLCommons specification","http://mlcommons.org/croissant/","cr:DataSource","Data Source","Describes how data are extracted or transformed from files file sets or record sets to populate a field.","NOT_APPLICABLE","NOT_APPLICABLE","NOT_APPLICABLE","NOT_APPLICABLE","NORMATIVE","REFERENCE_IMPLEMENTATION_VALIDATOR; no normative SHACL identified","Represent machine-actionable source extraction and transformation paths.","Does not supply responsible agent execution timestamp result integrity or legal authority without provenance extensions.","Croissant 1.1 §RecordSets — DataSource"
"EL-CROISSANT-Dataset-recordSet","STD-CROISSANT-1.1","1.1","COMMUNITY_SPEC — MLCommons specification","http://mlcommons.org/croissant/","cr:recordSet","record set","Relates a dataset description to structured RecordSet definitions.","schema:Dataset","cr:RecordSet","0..*","NOT_APPLICABLE","NORMATIVE","REFERENCE_IMPLEMENTATION_VALIDATOR; no normative SHACL identified","Attach record and variable structure to the dataset.","Optional relation means Croissant conformance does not necessarily provide record-level structure for every dataset.","Croissant 1.1 §Format Example and Appendix 1 context — cr:recordSet"
"EL-CROISSANT-RecordSet-field","STD-CROISSANT-1.1","1.1","COMMUNITY_SPEC — MLCommons specification","http://mlcommons.org/croissant/","cr:field","field","Relates a RecordSet to data elements appearing in its records.","cr:RecordSet","cr:Field","0..*","NOT_APPLICABLE","NORMATIVE","REFERENCE_IMPLEMENTATION_VALIDATOR; no normative SHACL identified","Enumerate columns variables or nested elements in a record structure.","The specification's MANY cardinality does not itself establish full enumeration or a minimum.","Croissant 1.1 §RecordSets — RecordSet property table"
"EL-CROISSANT-Field-source","STD-CROISSANT-1.1","1.1","COMMUNITY_SPEC — MLCommons specification","http://mlcommons.org/croissant/","cr:source","field source","Identifies a DataSource FileObject or FileSet from which field data originate.","cr:Field","cr:DataSource or cr:FileObject or cr:FileSet","0..1","NOT_APPLICABLE","NORMATIVE","REFERENCE_IMPLEMENTATION_VALIDATOR; no normative SHACL identified","Trace a field to its source file collection or extraction description.","Optional relation does not guarantee complete lineage and source assertions need provenance evidence.","Croissant 1.1 §RecordSets — Field property table and DataSource introduction"
"EL-CROISSANT-DataSource-extract","STD-CROISSANT-1.1","1.1","COMMUNITY_SPEC — MLCommons specification","http://mlcommons.org/croissant/","cr:extract","extract","Identifies an extraction method selecting content such as a column file property or JSON path from a source.","cr:DataSource","cr:Extract","0..1","NOT_APPLICABLE","NORMATIVE","REFERENCE_IMPLEMENTATION_VALIDATOR; no normative SHACL identified","Describe deterministic selection of source data for a field.","Does not record software version execution result or validation of the extraction.","Croissant 1.1 §RecordSets — DataSource property table and Extract subsection"
"EL-CROISSANT-DataSource-transform","STD-CROISSANT-1.1","1.1","COMMUNITY_SPEC — MLCommons specification","http://mlcommons.org/croissant/","cr:transform","transform","Identifies one or more transformations applied to source data after extraction.","cr:DataSource","cr:Transform","0..*","NOT_APPLICABLE","NORMATIVE","REFERENCE_IMPLEMENTATION_VALIDATOR; no normative SHACL identified","Represent preprocessing transformations in a machine-loadable dataset description.","Transformation semantics are narrower than a full governed processing activity and lack agent time plan and evidence by themselves.","Croissant 1.1 §RecordSets — DataSource property table and Transform subsection"
"EL-CROISSANT-FileObject-sha256","STD-CROISSANT-1.1","1.1","COMMUNITY_SPEC — MLCommons specification","http://schema.org/","schema:sha256","SHA-256 checksum","A SHA-256 checksum for FileObject content; strongly recommended for files in versioned datasets.","cr:FileObject","schema:Text","0..1","SHA-256","NORMATIVE","REFERENCE_IMPLEMENTATION_VALIDATOR; no normative SHACL identified","Support integrity checking and reproducible dataset versions.","Optional checksum must be recomputed against retrieved bytes and does not prove source authority or legal permissibility.","Croissant 1.1 §Resources — FileObject property table; §Dataset Versioning/Checkpoints — Checksums"
"EL-CROISSANT-Split","STD-CROISSANT-1.1","1.1","COMMUNITY_SPEC — MLCommons specification","http://mlcommons.org/croissant/","cr:Split","Split","A semantic datatype used to identify arbitrary dataset partitions including training validation and test splits.","NOT_APPLICABLE","NOT_APPLICABLE","NOT_APPLICABLE","cr:TrainingSplit|cr:ValidationSplit|cr:TestSplit and dataset-defined splits","NORMATIVE","REFERENCE_IMPLEMENTATION_VALIDATOR; no normative SHACL identified","Identify training validation test or other dataset partitions.","Does not record sampling rationale leakage controls representativeness or actual model use.","Croissant 1.1 §Data Types — Splits"
"EL-CROISSANT-Label","STD-CROISSANT-1.1","1.1","COMMUNITY_SPEC — MLCommons specification","http://mlcommons.org/croissant/","cr:Label","Label","A semantic datatype identifying label data typically represented as fields in a RecordSet.","NOT_APPLICABLE","NOT_APPLICABLE","NOT_APPLICABLE","NOT_APPLICABLE","NORMATIVE","REFERENCE_IMPLEMENTATION_VALIDATOR; no normative SHACL identified","Mark fields or complex annotations as ML labels.","Does not describe annotation workforce protocol disagreement quality review or label validity without additional properties.","Croissant 1.1 §Data Types — Label Data"
"EL-CROISSANT-Dataset-version","STD-CROISSANT-1.1","1.1","COMMUNITY_SPEC — MLCommons specification","http://schema.org/","schema:version","dataset version","A recommended dataset version using a major minor patch convention described by Croissant.","schema:Dataset","schema:Number or schema:Text","0..1","Semantic Versioning 2.0.0 recommended","NORMATIVE","REFERENCE_IMPLEMENTATION_VALIDATOR; no normative SHACL identified","Identify dataset content versions for reproducibility and change analysis.","Version semantics depend on producer discipline and do not ensure immutable retrieval.","Croissant 1.1 §Dataset-level Information — recommended properties; §Dataset Versioning/Checkpoints"
"EL-CROISSANTRAI-dataCollection","STD-CROISSANTRAI-1.0","1.0","COMMUNITY_SPEC — MLCommons specification","http://mlcommons.org/croissant/RAI/","rai:dataCollection","data collection","Text describing the dataset's collection process.","schema:Dataset","schema:Text","0..1","NOT_APPLICABLE","NORMATIVE","NONE_IDENTIFIED","Document the collection process for AI dataset review.","Optional free text does not structure sources sampling roles original purpose or evidence and is not Article 10 compliance.","Croissant RAI 1.0 §RAI property information — rai:dataCollection"
"EL-CROISSANTRAI-dataCollectionType","STD-CROISSANTRAI-1.0","1.0","COMMUNITY_SPEC — MLCommons specification","http://mlcommons.org/croissant/RAI/","rai:dataCollectionType","data collection type","Text classifying the data collection method using recommended values such as surveys direct measurement software collection or web APIs.","schema:Dataset","schema:Text","0..*","Recommended non-closed list in RAI property table","NORMATIVE","NONE_IDENTIFIED","Classify one or more collection modes.","Recommended strings are not a formal controlled vocabulary and do not capture method parameters or legality.","Croissant RAI 1.0 §RAI property information — rai:dataCollectionType"
"EL-CROISSANTRAI-dataCollectionMissingData","STD-CROISSANTRAI-1.0","1.0","COMMUNITY_SPEC — MLCommons specification","http://mlcommons.org/croissant/RAI/","rai:dataCollectionMissingData","missing-data description","Text describing missing data in structured or unstructured form.","schema:Dataset","schema:Text","0..1","NOT_APPLICABLE","NORMATIVE","NONE_IDENTIFIED","Document known missing data for quality and gap review.","No missingness metric mechanism pattern uncertainty threshold or remediation evidence is required.","Croissant RAI 1.0 §RAI property information — rai:dataCollectionMissingData"
"EL-CROISSANTRAI-dataCollectionRawData","STD-CROISSANTRAI-1.0","1.0","COMMUNITY_SPEC — MLCommons specification","http://mlcommons.org/croissant/RAI/","rai:dataCollectionRawData","raw-data source description","Text describing the raw data or source from which the dataset was produced.","schema:Dataset","schema:Text","0..1","NOT_APPLICABLE","NORMATIVE","NONE_IDENTIFIED","Document original source material.","Free text is not a structured provenance chain and does not prove source authority ownership consent or licence.","Croissant RAI 1.0 §RAI property information — rai:dataCollectionRawData"
"EL-CROISSANTRAI-dataCollectionTimeframe","STD-CROISSANTRAI-1.0","1.0","COMMUNITY_SPEC — MLCommons specification","http://mlcommons.org/croissant/RAI/","rai:dataCollectionTimeframe","collection timeframe","Date-time values representing the start and end timeframe of collection.","schema:Dataset","schema:DateTime","0..*","NOT_APPLICABLE","NORMATIVE","NONE_IDENTIFIED","Record temporal scope of the collection process.","The MANY date-time structure does not formally distinguish start from end in the property table and does not model source-specific intervals.","Croissant RAI 1.0 §RAI property information — rai:dataCollectionTimeframe"
"EL-CROISSANTRAI-dataImputationProtocol","STD-CROISSANTRAI-1.0","1.0","COMMUNITY_SPEC — MLCommons specification","http://mlcommons.org/croissant/RAI/","rai:dataImputationProtocol","data imputation protocol","Text describing the data-imputation process when applicable.","schema:Dataset","schema:Text","0..1","NOT_APPLICABLE","NORMATIVE","NONE_IDENTIFIED","Document how missing values were imputed.","Does not encode executable method parameters affected fields validation or bias effects.","Croissant RAI 1.0 §RAI property information — rai:dataImputationProtocol"
"EL-CROISSANTRAI-dataManipulationProtocol","STD-CROISSANTRAI-1.0","1.0","COMMUNITY_SPEC — MLCommons specification","http://mlcommons.org/croissant/RAI/","rai:dataManipulationProtocol","data manipulation protocol","Text describing data manipulation when applicable.","schema:Dataset","schema:Text","0..1","NOT_APPLICABLE","NORMATIVE","NONE_IDENTIFIED","Document manipulation performed during dataset preparation.","Broad free text does not distinguish cleaning updating enrichment aggregation or responsibility and execution evidence.","Croissant RAI 1.0 §RAI property information — rai:dataManipulationProtocol"
"EL-CROISSANTRAI-dataPreprocessingProtocol","STD-CROISSANTRAI-1.0","1.0","COMMUNITY_SPEC — MLCommons specification","http://mlcommons.org/croissant/RAI/","rai:dataPreprocessingProtocol","data preprocessing protocol","Text describing steps used to bring collected data into a form processable by an ML model or algorithm.","schema:Dataset","schema:Text","0..*","NOT_APPLICABLE","NORMATIVE","NONE_IDENTIFIED","Document filtering cleaning and other preprocessing steps.","Does not encode ordered executable transformations versions agents outputs or quality effects.","Croissant RAI 1.0 §RAI property information — rai:dataPreprocessingProtocol"
"EL-CROISSANTRAI-dataAnnotationProtocol","STD-CROISSANTRAI-1.0","1.0","COMMUNITY_SPEC — MLCommons specification","http://mlcommons.org/croissant/RAI/","rai:dataAnnotationProtocol","data annotation protocol","Text describing labels or ratings produced and how annotation tasks were authored or performed.","schema:Dataset","schema:Text","0..1","NOT_APPLICABLE","NORMATIVE","NONE_IDENTIFIED","Document annotation and labeling design.","Free text does not guarantee record-level linkage workforce consent quality review or inter-annotator analysis.","Croissant RAI 1.0 §RAI property information — rai:dataAnnotationProtocol"
"EL-CROISSANTRAI-dataAnnotationPlatform","STD-CROISSANTRAI-1.0","1.0","COMMUNITY_SPEC — MLCommons specification","http://mlcommons.org/croissant/RAI/","rai:dataAnnotationPlatform","data annotation platform","Text identifying platforms tools or libraries used to collect human annotations.","schema:Dataset","schema:Text","0..*","NOT_APPLICABLE","NORMATIVE","NONE_IDENTIFIED","Identify tooling used in annotation and labeling.","Does not require tool version configuration operator or audit evidence.","Croissant RAI 1.0 §RAI property information — rai:dataAnnotationPlatform"
"EL-CROISSANTRAI-dataAnnotationAnalysis","STD-CROISSANTRAI-1.0","1.0","COMMUNITY_SPEC — MLCommons specification","http://mlcommons.org/croissant/RAI/","rai:dataAnnotationAnalysis","data annotation analysis","Text describing conversion of raw annotations into final labels including uncertainty disagreement and systematic group differences.","schema:Dataset","schema:Text","0..*","NOT_APPLICABLE","NORMATIVE","NONE_IDENTIFIED","Document annotation aggregation disagreement and validation considerations.","Does not require metrics methods values thresholds or record-level evidence.","Croissant RAI 1.0 §RAI property information — rai:dataAnnotationAnalysis"
"EL-CROISSANTRAI-dataReleaseMaintenancePlan","STD-CROISSANTRAI-1.0","1.0","COMMUNITY_SPEC — MLCommons specification","http://mlcommons.org/croissant/RAI/","rai:dataReleaseMaintenancePlan","data release maintenance plan","Text describing updating timeframes maintainers versioning and deprecation policies.","schema:Dataset","schema:Text","0..*","NOT_APPLICABLE","NORMATIVE","NONE_IDENTIFIED","Document dataset update maintenance and deprecation arrangements.","Does not prove implementation ownership service levels or change notification.","Croissant RAI 1.0 §RAI property information — rai:dataReleaseMaintenancePlan"
"EL-CROISSANTRAI-personalSensitiveInformation","STD-CROISSANTRAI-1.0","1.0","COMMUNITY_SPEC — MLCommons specification","http://mlcommons.org/croissant/RAI/","rai:personalSensitiveInformation","personal or sensitive information","Text describing sensitive human attributes present in a dataset.","schema:Dataset","schema:Text","0..*","Recommended attribute categories in RAI property table","NORMATIVE","NONE_IDENTIFIED","Flag personal or sensitive information for governance review.","Narrative disclosure does not determine GDPR or AI Act legal category necessity safeguards lawful basis or actual content.","Croissant RAI 1.0 §RAI property information — rai:personalSensitiveInformation"
"EL-CROISSANTRAI-dataBiases","STD-CROISSANTRAI-1.0","1.0","COMMUNITY_SPEC — MLCommons specification","http://mlcommons.org/croissant/RAI/","rai:dataBiases","data biases","Text describing biases identified in the dataset when applicable.","schema:Dataset","schema:Text","0..*","NOT_APPLICABLE","NORMATIVE","NONE_IDENTIFIED","Document known bias for safety and fairness review.","No examination method statistical result mitigation residual risk or representativeness test is required.","Croissant RAI 1.0 §RAI property information — rai:dataBiases"
"EL-CROISSANTRAI-dataLimitations","STD-CROISSANTRAI-1.0","1.0","COMMUNITY_SPEC — MLCommons specification","http://mlcommons.org/croissant/RAI/","rai:dataLimitations","data limitations","Text describing known generalization limits quality issues source limitations and non-recommended uses.","schema:Dataset","schema:Text","0..*","NOT_APPLICABLE","NORMATIVE","NONE_IDENTIFIED","Document known shortcomings and limits of dataset use.","Does not require remediation status severity evidence or a complete Article 10 gaps-and-remedies analysis.","Croissant RAI 1.0 §RAI property information — rai:dataLimitations"
"EL-CROISSANTRAI-dataUseCases","STD-CROISSANTRAI-1.0","1.0","COMMUNITY_SPEC — MLCommons specification","http://mlcommons.org/croissant/RAI/","rai:dataUseCases","data use cases","Text describing recommended dataset uses such as training testing validation development production or fine tuning.","schema:Dataset","schema:Text","0..*","Recommended use labels in RAI property table","NORMATIVE","NONE_IDENTIFIED","Document intended or recommended ML dataset uses.","Does not model the AI system's geographic contextual behavioral and functional setting or legally determine suitable use.","Croissant RAI 1.0 §RAI property information — rai:dataUseCases"
"EL-ELI-LegalResource","STD-ELI-1.3","1.3","EU_RECOMMENDATION — Publications Office ontology release","http://data.europa.eu/eli/ontology#","eli:LegalResource","Legal Resource","A work in a legislative corpus including an enacted act or a component such as an article.","NOT_APPLICABLE","NOT_APPLICABLE","NOT_APPLICABLE","NOT_APPLICABLE","NORMATIVE","NONE_IDENTIFIED","Identify the abstract legal act or provision referenced by metadata.","Does not represent an extracted atomic rule modality applicability conditions or compliance result.","ELI core 1.3 versioned OWL — owl:Class http://data.europa.eu/eli/ontology#LegalResource"
"EL-ELI-LegalExpression","STD-ELI-1.3","1.3","EU_RECOMMENDATION — Publications Office ontology release","http://data.europa.eu/eli/ontology#","eli:LegalExpression","Legal Expression","The intellectual realization of a legal resource as a sequence of signs differentiated for example by language or version.","NOT_APPLICABLE","NOT_APPLICABLE","NOT_APPLICABLE","NOT_APPLICABLE","NORMATIVE","NONE_IDENTIFIED","Identify language- or version-specific legal text expressions.","Expression identity choices may vary by publisher and do not establish legal status or faithful extraction.","ELI core 1.3 versioned OWL — owl:Class http://data.europa.eu/eli/ontology#LegalExpression"
"EL-ELI-Format","STD-ELI-1.3","1.3","EU_RECOMMENDATION — Publications Office ontology release","http://data.europa.eu/eli/ontology#","eli:Format","Format","A physical or electronic embodiment of a legal expression with a required eli:format value.","NOT_APPLICABLE","NOT_APPLICABLE","NOT_APPLICABLE","NOT_APPLICABLE","NORMATIVE","NONE_IDENTIFIED","Identify PDF XML paper or other manifestations of a legal expression.","Format does not prove authenticity official status content equivalence or source status.","ELI core 1.3 versioned OWL — owl:Class http://data.europa.eu/eli/ontology#Format"
"EL-ELI-LegalResourceSubdivision","STD-ELI-1.3","1.3","EU_RECOMMENDATION — Publications Office ontology release","http://data.europa.eu/eli/ontology#","eli:LegalResourceSubdivision","Legal Resource Subdivision","A component of a legal act at arbitrary precision such as chapter article paragraph or list item.","NOT_APPLICABLE","NOT_APPLICABLE","NOT_APPLICABLE","NOT_APPLICABLE","NORMATIVE","NONE_IDENTIFIED","Identify stable article paragraph point or other provision subdivisions.","By itself, the class identifies a structural subdivision but does not represent the complete traceability information used in this study, such as the extracted proposition, source version, registered dependencies, their interpreted effect, or applicability. ELI does not prohibit those additions, but they require other properties, components, or documented rules.","ELI core 1.3 versioned OWL — owl:Class http://data.europa.eu/eli/ontology#LegalResourceSubdivision"
"EL-ELI-isPartOf","STD-ELI-1.3","1.3","EU_RECOMMENDATION — Publications Office ontology release","http://data.europa.eu/eli/ontology#","eli:is_part_of","is part of","Relates a work to another work in which it is physically included such as an article within a text.","eli:Work","eli:Work","UNCONSTRAINED_BY_ELI_OWL","NOT_APPLICABLE","NORMATIVE","NONE_IDENTIFIED","Link a legal subdivision to its containing act or higher subdivision.","Physical inclusion must not be confused with conceptual or temporal membership and no closed-world parent cardinality is imposed.","ELI core 1.3 versioned OWL — owl:ObjectProperty http://data.europa.eu/eli/ontology#is_part_of"
"EL-ELI-dateDocument","STD-ELI-1.3","1.3","EU_RECOMMENDATION — Publications Office ontology release","http://data.europa.eu/eli/ontology#","eli:date_document","date of document","The adoption or signature date of a work expressed as xsd:date.","eli:Work","xsd:date","0..1; owl:FunctionalProperty","NOT_APPLICABLE","NORMATIVE","NONE_IDENTIFIED","Record adoption or signature date of the legal source.","Does not distinguish adoption from signature where both matter and is not the publication entry-into-force or application date.","ELI core 1.3 versioned OWL — owl:DatatypeProperty http://data.europa.eu/eli/ontology#date_document"
"EL-ELI-firstDateEntryInForce","STD-ELI-1.3","1.3","EU_RECOMMENDATION — Publications Office ontology release","http://data.europa.eu/eli/ontology#","eli:first_date_entry_in_force","first date of entry into force","The first date on which any part of a legal resource or expression came into force.","eli:LegalResource or eli:LegalExpression","xsd:date","0..1; owl:FunctionalProperty","NOT_APPLICABLE","NORMATIVE","NONE_IDENTIFIED","Record first entry into force of a legal source.","Does not represent staged application article-specific dates transition rules or later amendments.","ELI core 1.3 versioned OWL — owl:DatatypeProperty http://data.europa.eu/eli/ontology#first_date_entry_in_force"
"EL-ELI-jurisdiction","STD-ELI-1.3","1.3","EU_RECOMMENDATION — Publications Office ontology release","http://data.europa.eu/eli/ontology#","eli:jurisdiction","jurisdiction","The jurisdiction from which the legal resource originates.","eli:LegalResource or eli:LegalExpression","eli:AdministrativeArea","UNCONSTRAINED_BY_ELI_OWL","EU Administrative Territorial Unit authority table recommended by ontology definition","NORMATIVE","NONE_IDENTIFIED","Identify source jurisdiction using controlled territorial identifiers.","Origin jurisdiction does not determine territorial applicability to a concrete use configuration.","ELI core 1.3 versioned OWL — owl:ObjectProperty http://data.europa.eu/eli/ontology#jurisdiction"
