"standard_element_id","standard_id","version","formal_status","namespace","class_or_property","human_label","normative_definition","domain","range","cardinality","controlled_vocabulary","normative_or_informative","validation_artifact","intended_capability","known_limit","source_pinpoint"
"EL-HEALTHDCATAP-Dataset-numberOfUniqueIndividuals","STD-HEALTHDCATAP-7","Release 7","EU_DRAFT — European Commission Draft Specification","http://healthdataportal.eu/ns/health#","healthdcatap:numberOfUniqueIndividuals","number of unique individuals","The number of unique individuals represented in the dataset.","dcat:Dataset","xsd:nonNegativeInteger","0..1","NOT_APPLICABLE","NORMATIVE_DRAFT_PROFILE_ELEMENT","https://healthdataeu.pages.code.europa.eu/healthdcat-ap/releases/release-7/html/shacl/public-shapes_recommended.ttl|https://healthdataeu.pages.code.europa.eu/healthdcat-ap/releases/release-7/html/shacl/restricted-shapes_recommended.ttl|https://healthdataeu.pages.code.europa.eu/healthdcat-ap/releases/release-7/html/shacl/non-public-shapes_recommended.ttl","Record the represented-person count for scope and coverage review.","Optional count lacks identity-resolution method uncertainty snapshot time and disclosure-risk controls.","HealthDCAT-AP Release 7 §Dataset.numberofuniqueindividuals"
"EL-HEALTHDCATAP-Dataset-populationCoverage","STD-HEALTHDCATAP-7","Release 7","EU_DRAFT — European Commission Draft Specification","http://healthdataportal.eu/ns/health#","healthdcatap:populationCoverage","population coverage","Describes populations or demographic groups covered by the dataset.","dcat:Dataset","rdfs:Literal","0..*","NOT_APPLICABLE","NORMATIVE_DRAFT_PROFILE_ELEMENT","https://healthdataeu.pages.code.europa.eu/healthdcat-ap/releases/release-7/html/shacl/public-shapes_recommended.ttl|https://healthdataeu.pages.code.europa.eu/healthdcat-ap/releases/release-7/html/shacl/restricted-shapes_recommended.ttl|https://healthdataeu.pages.code.europa.eu/healthdcat-ap/releases/release-7/html/shacl/non-public-shapes_recommended.ttl","Describe represented population for discovery and representativeness assessment.","Free text has no denominator sampling method uncertainty or controlled demographic semantics and cannot establish representative coverage.","HealthDCAT-AP Release 7 §Dataset.populationcoverage"
"EL-HEALTHDCATAP-Dataset-retentionPeriod","STD-HEALTHDCATAP-7","Release 7","EU_DRAFT — European Commission Draft Specification","http://healthdataportal.eu/ns/health#","healthdcatap:retentionPeriod","retention period","The period for which the health data is retained.","dcat:Dataset","dct:PeriodOfTime","0..1","NOT_APPLICABLE","NORMATIVE_DRAFT_PROFILE_ELEMENT","https://healthdataeu.pages.code.europa.eu/healthdcat-ap/releases/release-7/html/shacl/public-shapes_recommended.ttl|https://healthdataeu.pages.code.europa.eu/healthdcat-ap/releases/release-7/html/shacl/restricted-shapes_recommended.ttl|https://healthdataeu.pages.code.europa.eu/healthdcat-ap/releases/release-7/html/shacl/non-public-shapes_recommended.ttl","Record a dataset-level retention interval.","Does not state legal basis trigger deletion event exemptions or actual enforcement.","HealthDCAT-AP Release 7 §Dataset.retentionPeriod"
"EL-HEALTHDCATAP-Dataset-hasQualityAnnotation","STD-HEALTHDCATAP-7","Release 7","EU_DRAFT — European Commission Draft Specification","http://www.w3.org/ns/dqv#","dqv:hasQualityAnnotation","quality annotation","Links a dataset to associated quality annotations constrained by the draft profile to Quality Certificate resources.","dcat:Dataset","dqv:QualityCertificate","0..*","NOT_APPLICABLE","NORMATIVE_DRAFT_PROFILE_ELEMENT","https://healthdataeu.pages.code.europa.eu/healthdcat-ap/releases/release-7/html/shacl/range.ttl|https://healthdataeu.pages.code.europa.eu/healthdcat-ap/releases/release-7/html/shacl/public-shapes.ttl","Attach a quality certificate or annotation to a health dataset.","No Article 78 dimension metric value method unit timestamp provenance or legal sufficiency is supplied by this link alone.","HealthDCAT-AP Release 7 §Dataset.qualityannotation; Release 7 range.ttl dqv:hasQualityAnnotation range constraint"
"EL-PROVO-Entity","STD-PROVO-2013","2013 Recommendation","INTERNATIONAL_STANDARD — W3C Recommendation","http://www.w3.org/ns/prov#","prov:Entity","Entity","A physical digital conceptual or other thing with fixed aspects; it may be real or imaginary.","NOT_APPLICABLE","NOT_APPLICABLE","NOT_APPLICABLE","NOT_APPLICABLE","NORMATIVE","NONE_IDENTIFIED","Represent a versioned dataset distribution document model or evidence object in provenance.","Entity typing does not prove identity integrity or evidential reliability.","PROV-O §3.1 Starting Point Terms — prov:Entity; https://www.w3.org/TR/2013/REC-prov-o-20130430/#Entity"
"EL-PROVO-Activity","STD-PROVO-2013","2013 Recommendation","INTERNATIONAL_STANDARD — W3C Recommendation","http://www.w3.org/ns/prov#","prov:Activity","Activity","Something occurring over time that acts upon or with entities including using transforming or generating them.","NOT_APPLICABLE","NOT_APPLICABLE","NOT_APPLICABLE","NOT_APPLICABLE","NORMATIVE","NONE_IDENTIFIED","Represent collection cleaning annotation aggregation quality measurement or other data lifecycle events.","Generic activity typing does not establish that a legally required operation occurred or was adequate.","PROV-O §3.1 Starting Point Terms — prov:Activity; https://www.w3.org/TR/2013/REC-prov-o-20130430/#Activity"
"EL-PROVO-Agent","STD-PROVO-2013","2013 Recommendation","INTERNATIONAL_STANDARD — W3C Recommendation","http://www.w3.org/ns/prov#","prov:Agent","Agent","Something bearing responsibility for an activity for an entity's existence or for another agent's activity.","NOT_APPLICABLE","NOT_APPLICABLE","NOT_APPLICABLE","NOT_APPLICABLE","NORMATIVE","NONE_IDENTIFIED","Identify a person organization or software agent associated with evidence and lifecycle actions.","A provenance agent is not automatically the legally responsible actor or statutory role-holder.","PROV-O §3.1 Starting Point Terms — prov:Agent; https://www.w3.org/TR/2013/REC-prov-o-20130430/#Agent"
"EL-PROVO-wasGeneratedBy","STD-PROVO-2013","2013 Recommendation","INTERNATIONAL_STANDARD — W3C Recommendation","http://www.w3.org/ns/prov#","prov:wasGeneratedBy","was generated by","Relates an entity to an activity whose completion resulted in the entity.","prov:Entity","prov:Activity","UNCONSTRAINED_BY_PROV_O","NOT_APPLICABLE","NORMATIVE","NONE_IDENTIFIED","Link a dataset version measurement report or metadata record to the activity that generated it.","Does not prove the stated generation event or completeness of inputs.","PROV-O §3.1 Starting Point Terms — prov:wasGeneratedBy"
"EL-PROVO-used","STD-PROVO-2013","2013 Recommendation","INTERNATIONAL_STANDARD — W3C Recommendation","http://www.w3.org/ns/prov#","prov:used","used","Relates an activity to an entity used before during or at the activity.","prov:Activity","prov:Entity","UNCONSTRAINED_BY_PROV_O","NOT_APPLICABLE","NORMATIVE","NONE_IDENTIFIED","Record source datasets files methods or plans used by a processing activity.","Does not establish that all inputs were disclosed or lawfully used.","PROV-O §3.1 Starting Point Terms — prov:used"
"EL-PROVO-wasDerivedFrom","STD-PROVO-2013","2013 Recommendation","INTERNATIONAL_STANDARD — W3C Recommendation","http://www.w3.org/ns/prov#","prov:wasDerivedFrom","was derived from","Relates a generated entity to another entity from which it was derived through an activity.","prov:Entity","prov:Entity","UNCONSTRAINED_BY_PROV_O","NOT_APPLICABLE","NORMATIVE","NONE_IDENTIFIED","Represent dataset lineage and transformation dependencies.","Does not identify the transformation method or determine whether derivation was legally permitted without additional activity and policy evidence.","PROV-O §3.2 Expanded Terms — prov:wasDerivedFrom"
"EL-PROVO-wasAttributedTo","STD-PROVO-2013","2013 Recommendation","INTERNATIONAL_STANDARD — W3C Recommendation","http://www.w3.org/ns/prov#","prov:wasAttributedTo","was attributed to","Relates an entity to an agent to whom it is attributed.","prov:Entity","prov:Agent","UNCONSTRAINED_BY_PROV_O","NOT_APPLICABLE","NORMATIVE","NONE_IDENTIFIED","Attribute a dataset metadata record or evidence artifact to an agent.","Attribution is not equivalent to legal responsibility ownership authorship or approval.","PROV-O §3.2 Expanded Terms — prov:wasAttributedTo"
"EL-PROVO-wasAssociatedWith","STD-PROVO-2013","2013 Recommendation","INTERNATIONAL_STANDARD — W3C Recommendation","http://www.w3.org/ns/prov#","prov:wasAssociatedWith","was associated with","Relates an activity to an agent bearing responsibility for it.","prov:Activity","prov:Agent","UNCONSTRAINED_BY_PROV_O","NOT_APPLICABLE","NORMATIVE","NONE_IDENTIFIED","Associate lifecycle or measurement activity with the responsible executing agent.","Association does not by itself encode the instrument-specific legal role authority or accountability allocation.","PROV-O §3.1 Starting Point Terms — prov:wasAssociatedWith"
"EL-PROVO-hadPrimarySource","STD-PROVO-2013","2013 Recommendation","INTERNATIONAL_STANDARD — W3C Recommendation","http://www.w3.org/ns/prov#","prov:hadPrimarySource","had primary source","Relates an entity to a primary source on which it depends for its content.","prov:Entity","prov:Entity","UNCONSTRAINED_BY_PROV_O","NOT_APPLICABLE","NORMATIVE","NONE_IDENTIFIED","Link extracted requirements or metadata evidence to an authoritative primary source.","The relation does not establish authoritative status authenticity or faithful extraction.","PROV-O §3.2 Expanded Terms — prov:hadPrimarySource"
"EL-PROVO-generatedAtTime","STD-PROVO-2013","2013 Recommendation","INTERNATIONAL_STANDARD — W3C Recommendation","http://www.w3.org/ns/prov#","prov:generatedAtTime","generated at time","Records the time at which an entity was completely created and became available for use.","prov:Entity","xsd:dateTime","UNCONSTRAINED_BY_PROV_O","NOT_APPLICABLE","NORMATIVE","NONE_IDENTIFIED","Timestamp creation of a versioned dataset measurement or evidence artifact.","A stated timestamp is not independently authenticated.","PROV-O §3.2 Expanded Terms — prov:generatedAtTime"
"EL-PROVO-qualifiedAssociation","STD-PROVO-2013","2013 Recommendation","INTERNATIONAL_STANDARD — W3C Recommendation","http://www.w3.org/ns/prov#","prov:qualifiedAssociation","qualified association","Links an activity to a qualified association that can identify agent role and plan.","prov:Activity","prov:Association","UNCONSTRAINED_BY_PROV_O","NOT_APPLICABLE","NORMATIVE","NONE_IDENTIFIED","Represent agent role and plan context for a processing or review activity.","Qualified provenance roles remain technical/contextual and must not replace instrument-specific legal-role determinations.","PROV-O §3.3 Qualified Terms — prov:qualifiedAssociation"
"EL-PROVO-hadRole","STD-PROVO-2013","2013 Recommendation","INTERNATIONAL_STANDARD — W3C Recommendation","http://www.w3.org/ns/prov#","prov:hadRole","had role","Identifies the function of an entity or agent with respect to an activity in a qualified influence.","prov:Influence","prov:Role","UNCONSTRAINED_BY_PROV_O","NOT_APPLICABLE","NORMATIVE","NONE_IDENTIFIED","Attach a versioned operational role to a qualified provenance relation.","Role values require a separate controlled profile and cannot infer legal status from organization type.","PROV-O §3.3 Qualified Terms — prov:hadRole"
"EL-PROVO-hadPlan","STD-PROVO-2013","2013 Recommendation","INTERNATIONAL_STANDARD — W3C Recommendation","http://www.w3.org/ns/prov#","prov:hadPlan","had plan","Relates an association to a plan intended by an agent to achieve goals in the associated activity.","prov:Association","prov:Plan","UNCONSTRAINED_BY_PROV_O","NOT_APPLICABLE","NORMATIVE","NONE_IDENTIFIED","Link a processing quality-assessment or review activity to its method or plan.","Does not demonstrate execution fidelity adequacy or approval of the plan.","PROV-O §3.3 Qualified Terms — prov:hadPlan"
"EL-DQV-QualityMeasurement","STD-DQV-2016","2016 Note","COMMUNITY_SPEC — W3C Working Group Note","http://www.w3.org/ns/dqv#","dqv:QualityMeasurement","Quality Measurement","An observation evaluating a resource against a specific quality metric.","NOT_APPLICABLE","NOT_APPLICABLE","NOT_APPLICABLE","NOT_APPLICABLE","VOCABULARY_DEFINITION_IN_W3C_NOTE","NONE_IDENTIFIED","Represent a metric result for a dataset or distribution.","The Note supplies no legal metric catalogue threshold or required measurement procedure.","DQV §4.1 Quality measurements — dqv:QualityMeasurement; https://www.w3.org/TR/2016/NOTE-vocab-dqv-20161215/#dqv:QualityMeasurement"
"EL-DQV-Metric","STD-DQV-2016","2016 Note","COMMUNITY_SPEC — W3C Working Group Note","http://www.w3.org/ns/dqv#","dqv:Metric","Metric","A standard for measuring a quality dimension; an observation links to the metric through dqv:isMeasurementOf.","NOT_APPLICABLE","NOT_APPLICABLE","NOT_APPLICABLE","NOT_APPLICABLE","VOCABULARY_DEFINITION_IN_W3C_NOTE","NONE_IDENTIFIED","Define the measure against which a quality value is produced.","No normative EHDS or AI Act metric definitions are supplied.","DQV §4.1 Quality measurements — dqv:Metric; https://www.w3.org/TR/2016/NOTE-vocab-dqv-20161215/#dqv:Metric"
"EL-DQV-Dimension","STD-DQV-2016","2016 Note","COMMUNITY_SPEC — W3C Working Group Note","http://www.w3.org/ns/dqv#","dqv:Dimension","Dimension","A quality characteristic relevant to a consumer in selecting whether a resource is fit for purpose.","NOT_APPLICABLE","NOT_APPLICABLE","NOT_APPLICABLE","NOT_APPLICABLE","VOCABULARY_DEFINITION_IN_W3C_NOTE","NONE_IDENTIFIED","Group metrics under characteristics such as completeness accuracy timeliness or consistency.","Section 7 example dimensions are non-normative and fitness remains purpose-dependent.","DQV §4.1 and §7 — dqv:Dimension; https://www.w3.org/TR/2016/NOTE-vocab-dqv-20161215/#dqv:Dimension"
"EL-DQV-Category","STD-DQV-2016","2016 Note","COMMUNITY_SPEC — W3C Working Group Note","http://www.w3.org/ns/dqv#","dqv:Category","Category","A group of quality dimensions under a common broader topic.","NOT_APPLICABLE","NOT_APPLICABLE","NOT_APPLICABLE","NOT_APPLICABLE","VOCABULARY_DEFINITION_IN_W3C_NOTE","NONE_IDENTIFIED","Organize quality dimensions into a profile-specific taxonomy.","No normative category hierarchy is mandated.","DQV §4.1 Quality measurements — dqv:Category"
"EL-DQV-QualityAnnotation","STD-DQV-2016","2016 Note","COMMUNITY_SPEC — W3C Working Group Note","http://www.w3.org/ns/dqv#","dqv:QualityAnnotation","Quality Annotation","A Web Annotation whose body contains a quality assessment certificate or feedback about a resource.","NOT_APPLICABLE","NOT_APPLICABLE","NOT_APPLICABLE","NOT_APPLICABLE","VOCABULARY_DEFINITION_IN_W3C_NOTE","NONE_IDENTIFIED","Attach human or machine quality commentary to a dataset or distribution.","An annotation records an assertion but does not establish accuracy authority or legal sufficiency.","DQV §4.3 Quality annotations — dqv:QualityAnnotation"
"EL-DQV-QualityCertificate","STD-DQV-2016","2016 Note","COMMUNITY_SPEC — W3C Working Group Note","http://www.w3.org/ns/dqv#","dqv:QualityCertificate","Quality Certificate","A quality annotation that associates a resource with a quality certificate.","NOT_APPLICABLE","NOT_APPLICABLE","NOT_APPLICABLE","NOT_APPLICABLE","VOCABULARY_DEFINITION_IN_W3C_NOTE","NONE_IDENTIFIED","Represent a certificate attached to a dataset or distribution.","No trust framework issuer competence certificate scheme validity or revocation semantics are supplied.","DQV §4.3 Quality annotations — dqv:QualityCertificate"
"EL-DQV-hasQualityMeasurement","STD-DQV-2016","2016 Note","COMMUNITY_SPEC — W3C Working Group Note","http://www.w3.org/ns/dqv#","dqv:hasQualityMeasurement","has quality measurement","Relates a resource to a quality measurement performed for it.","rdfs:Resource","dqv:QualityMeasurement","UNCONSTRAINED_BY_DQV","NOT_APPLICABLE","VOCABULARY_DEFINITION_IN_W3C_NOTE","NONE_IDENTIFIED","Attach one or more explicit metric results to a dataset or distribution.","DQV imposes no minimum count and the link does not ensure the legally relevant dimensions were measured.","DQV §4.1 Quality measurements — dqv:hasQualityMeasurement"
"EL-DQV-computedOn","STD-DQV-2016","2016 Note","COMMUNITY_SPEC — W3C Working Group Note","http://www.w3.org/ns/dqv#","dqv:computedOn","computed on","Identifies the resource on which a quality measurement is computed.","dqv:QualityMeasurement","rdfs:Resource","UNCONSTRAINED_BY_DQV","NOT_APPLICABLE","VOCABULARY_DEFINITION_IN_W3C_NOTE","NONE_IDENTIFIED","Bind a measurement to the exact dataset distribution or other measured resource.","Version identity and measurement scope still require explicit resource versioning.","DQV §4.1 Quality measurements — dqv:computedOn"
"EL-DQV-isMeasurementOf","STD-DQV-2016","2016 Note","COMMUNITY_SPEC — W3C Working Group Note","http://www.w3.org/ns/dqv#","dqv:isMeasurementOf","is measurement of","Identifies the metric used for a quality measurement.","dqv:QualityMeasurement","dqv:Metric","UNCONSTRAINED_BY_DQV","NOT_APPLICABLE","VOCABULARY_DEFINITION_IN_W3C_NOTE","NONE_IDENTIFIED","Link each value to an explicit metric definition.","Metric existence does not establish method validity or legal relevance.","DQV §4.1 Quality measurements — dqv:isMeasurementOf"
"EL-DQV-value","STD-DQV-2016","2016 Note","COMMUNITY_SPEC — W3C Working Group Note","http://www.w3.org/ns/dqv#","dqv:value","value","The value of a quality measurement.","dqv:QualityMeasurement","rdfs:Literal","UNCONSTRAINED_BY_DQV","NOT_APPLICABLE","VOCABULARY_DEFINITION_IN_W3C_NOTE","NONE_IDENTIFIED","Record the observed measurement result.","Datatype unit uncertainty confidence and acceptance threshold must be supplied separately.","DQV §4.1 Quality measurements — dqv:value"
"EL-DQV-unitMeasure","STD-DQV-2016","2016 Note","COMMUNITY_SPEC — W3C Working Group Note","http://www.w3.org/ns/dqv#","dqv:unitMeasure","unit of measure","Identifies the unit associated with a quality measurement value.","dqv:QualityMeasurement","rdfs:Resource","UNCONSTRAINED_BY_DQV","NOT_APPLICABLE","VOCABULARY_DEFINITION_IN_W3C_NOTE","NONE_IDENTIFIED","Make numeric quality results interpretable and comparable.","DQV does not mandate a unit vocabulary or dimensional-consistency checks.","DQV §4.1 Quality measurements — dqv:unitMeasure"
"EL-DQV-expectedDataType","STD-DQV-2016","2016 Note","COMMUNITY_SPEC — W3C Working Group Note","http://www.w3.org/ns/dqv#","dqv:expectedDataType","expected data type","Identifies the expected datatype for values produced by a metric.","dqv:Metric","rdfs:Datatype","UNCONSTRAINED_BY_DQV","NOT_APPLICABLE","VOCABULARY_DEFINITION_IN_W3C_NOTE","NONE_IDENTIFIED","Declare the expected representation of metric results for validation.","Datatype validation alone does not check formula method or plausibility.","DQV §4.1 Quality measurements — dqv:expectedDataType"
"EL-DQV-inDimension","STD-DQV-2016","2016 Note","COMMUNITY_SPEC — W3C Working Group Note","http://www.w3.org/ns/dqv#","dqv:inDimension","in dimension","Relates a metric to the quality dimension it measures.","dqv:Metric","dqv:Dimension","UNCONSTRAINED_BY_DQV","NOT_APPLICABLE","VOCABULARY_DEFINITION_IN_W3C_NOTE","NONE_IDENTIFIED","Classify a metric under a legally or operationally relevant quality dimension.","The dimension and mapping require a separate reviewed profile.","DQV §4.1 Quality measurements — dqv:inDimension"
"EL-ODRL-Policy","STD-ODRL-2.2","2.2","INTERNATIONAL_STANDARD — W3C Recommendation","http://www.w3.org/ns/odrl/2/","odrl:Policy","Policy","A non-empty group of permissions prohibitions or duties expressing rules over assets.","NOT_APPLICABLE","NOT_APPLICABLE","NOT_APPLICABLE","NOT_APPLICABLE","NORMATIVE","NONE_IDENTIFIED","Represent a machine-readable policy governing access or use of an asset.","Policy syntax does not establish legal authority validity monitoring or enforcement.","ODRL Information Model 2.2 §2.1 Policy Class"
"EL-ODRL-Permission","STD-ODRL-2.2","2.2","INTERNATIONAL_STANDARD — W3C Recommendation","http://www.w3.org/ns/odrl/2/","odrl:Permission","Permission","A rule permitting an action on an asset and optionally requiring duties or constraints.","NOT_APPLICABLE","NOT_APPLICABLE","NOT_APPLICABLE","NOT_APPLICABLE","NORMATIVE","NONE_IDENTIFIED","Represent allowed access or downstream use.","Legal permission scope and enforceability depend on external law contract and authority.","ODRL Information Model 2.2 §2.2 Rule Class and §2.3 Permission Class"
"EL-ODRL-Prohibition","STD-ODRL-2.2","2.2","INTERNATIONAL_STANDARD — W3C Recommendation","http://www.w3.org/ns/odrl/2/","odrl:Prohibition","Prohibition","A rule prohibiting an action on an asset subject to any stated constraints.","NOT_APPLICABLE","NOT_APPLICABLE","NOT_APPLICABLE","NOT_APPLICABLE","NORMATIVE","NONE_IDENTIFIED","Represent prohibited access or use.","Does not determine governing law legal exceptions conflict priority or enforcement.","ODRL Information Model 2.2 §2.2 Rule Class and §2.4 Prohibition Class"
"EL-ODRL-Duty","STD-ODRL-2.2","2.2","INTERNATIONAL_STANDARD — W3C Recommendation","http://www.w3.org/ns/odrl/2/","odrl:Duty","Duty","A rule requiring an action that may serve as an obligation consequence or remedy in a policy.","NOT_APPLICABLE","NOT_APPLICABLE","NOT_APPLICABLE","NOT_APPLICABLE","NORMATIVE","NONE_IDENTIFIED","Represent policy duties such as attribution anonymization deletion or compensation.","An ODRL duty is a policy construct and not automatically a binding legal obligation.","ODRL Information Model 2.2 §2.5 Duty Class"
"EL-ODRL-Constraint","STD-ODRL-2.2","2.2","INTERNATIONAL_STANDARD — W3C Recommendation","http://www.w3.org/ns/odrl/2/","odrl:Constraint","Constraint","An atomic condition comparing a left operand with a right operand using an operator.","NOT_APPLICABLE","NOT_APPLICABLE","NOT_APPLICABLE","NOT_APPLICABLE","NORMATIVE","NONE_IDENTIFIED","Represent temporal purpose spatial recipient count or other policy conditions.","Open-textured legal conditions require a versioned profile and reviewed interpretation.","ODRL Information Model 2.2 §2.6 Constraint Class"
"EL-ODRL-uid","STD-ODRL-2.2","2.2","INTERNATIONAL_STANDARD — W3C Recommendation","http://www.w3.org/ns/odrl/2/","odrl:uid","policy identifier","An absolute IRI uniquely identifying a policy.","odrl:Policy","xsd:anyURI","1","NOT_APPLICABLE","NORMATIVE","NONE_IDENTIFIED","Give a policy a stable reference identifier.","Uniqueness and persistence depend on issuer governance.","ODRL Information Model 2.2 §2.1 Policy Class — uid relation"
"EL-ODRL-permission","STD-ODRL-2.2","2.2","INTERNATIONAL_STANDARD — W3C Recommendation","http://www.w3.org/ns/odrl/2/","odrl:permission","permission rule","Relates a policy to a permission rule.","odrl:Policy","odrl:Permission","0..*; at least one of permission|prohibition|obligation per Policy","NOT_APPLICABLE","NORMATIVE","NONE_IDENTIFIED","Attach permitted actions to a policy.","Rule completeness and conflict resolution require processor and profile context.","ODRL Information Model 2.2 §2.1 Policy Class — permission relation"
"EL-ODRL-prohibition","STD-ODRL-2.2","2.2","INTERNATIONAL_STANDARD — W3C Recommendation","http://www.w3.org/ns/odrl/2/","odrl:prohibition","prohibition rule","Relates a policy to a prohibition rule.","odrl:Policy","odrl:Prohibition","0..*; at least one of permission|prohibition|obligation per Policy","NOT_APPLICABLE","NORMATIVE","NONE_IDENTIFIED","Attach prohibited actions to a policy.","Legal priority exceptions and remedies remain external unless explicitly profiled.","ODRL Information Model 2.2 §2.1 Policy Class — prohibition relation"
"EL-ODRL-obligation","STD-ODRL-2.2","2.2","INTERNATIONAL_STANDARD — W3C Recommendation","http://www.w3.org/ns/odrl/2/","odrl:obligation","obligation rule","Relates a policy to a duty that must be fulfilled.","odrl:Policy","odrl:Duty","0..*; at least one of permission|prohibition|obligation per Policy","NOT_APPLICABLE","NORMATIVE","NONE_IDENTIFIED","Attach standalone duties to a policy.","Policy duty expression does not prove fulfilment or legal enforceability.","ODRL Information Model 2.2 §2.1 Policy Class — obligation relation"
"EL-ODRL-target","STD-ODRL-2.2","2.2","INTERNATIONAL_STANDARD — W3C Recommendation","http://www.w3.org/ns/odrl/2/","odrl:target","target asset","Identifies the asset to which a rule applies.","odrl:Rule","odrl:Asset","CONTEXT_DEPENDENT; explicit or inherited in compact policy representation","NOT_APPLICABLE","NORMATIVE","NONE_IDENTIFIED","Bind permissions prohibitions and duties to a dataset distribution service or other asset.","Asset identity and version must be externally governed.","ODRL Information Model 2.2 §2.2 Rule Class — target relation"
"EL-ODRL-action","STD-ODRL-2.2","2.2","INTERNATIONAL_STANDARD — W3C Recommendation","http://www.w3.org/ns/odrl/2/","odrl:action","action","Identifies the action governed by a permission prohibition or duty.","odrl:Rule","odrl:Action","1","odrl:use|read|extract|derive|modify|distribute|anonymize|delete and profile-defined actions","NORMATIVE","NONE_IDENTIFIED","Represent the type of access use transformation transfer or policy duty.","Generic actions need profile semantics to align with instrument-specific legal conduct.","ODRL Information Model 2.2 §2.2 Rule Class; ODRL Vocabulary 2.2 §3 Actions and §4 Common Vocabulary"
