"standard_element_id","standard_id","version","formal_status","namespace","class_or_property","human_label","normative_definition","domain","range","cardinality","controlled_vocabulary","normative_or_informative","validation_artifact","intended_capability","known_limit","source_pinpoint"
"EL-ODRL-assigner","STD-ODRL-2.2","2.2","INTERNATIONAL_STANDARD — W3C Recommendation","http://www.w3.org/ns/odrl/2/","odrl:assigner","assigner","Identifies the party assigning a rule.","odrl:Rule","odrl:Party","0..1","NOT_APPLICABLE","NORMATIVE","NONE_IDENTIFIED","Identify the policy-granting or duty-imposing party.","Does not prove the party has authority to assign the rule.","ODRL Information Model 2.2 §2.2 Rule Class — assigner relation"
"EL-ODRL-assignee","STD-ODRL-2.2","2.2","INTERNATIONAL_STANDARD — W3C Recommendation","http://www.w3.org/ns/odrl/2/","odrl:assignee","assignee","Identifies the party to whom a rule is assigned.","odrl:Rule","odrl:Party","0..1","NOT_APPLICABLE","NORMATIVE","NONE_IDENTIFIED","Identify the policy recipient or duty bearer.","Does not determine the recipient's instrument-specific legal role or eligibility.","ODRL Information Model 2.2 §2.2 Rule Class — assignee relation"
"EL-ODRL-constraint","STD-ODRL-2.2","2.2","INTERNATIONAL_STANDARD — W3C Recommendation","http://www.w3.org/ns/odrl/2/","odrl:constraint","constraint relation","Relates a rule to a condition that refines when its action is permitted prohibited or required.","odrl:Rule","odrl:Constraint","0..*","NOT_APPLICABLE","NORMATIVE","NONE_IDENTIFIED","Attach purpose time spatial recipient count or other conditions to a rule.","Constraint interpretation and conflict handling require a shared ODRL profile.","ODRL Information Model 2.2 §2.2 Rule Class — constraint relation"
"EL-ODRL-leftOperand","STD-ODRL-2.2","2.2","INTERNATIONAL_STANDARD — W3C Recommendation","http://www.w3.org/ns/odrl/2/","odrl:leftOperand","left operand","Identifies the property of an asset party action or environment being compared in an atomic constraint.","odrl:Constraint","odrl:LeftOperand","1","Includes odrl:purpose|dateTime|recipient|spatial|count|percentage and profile-defined operands","NORMATIVE","NONE_IDENTIFIED","Select the policy fact constrained by a rule.","A generic operand may not capture the legal definition or evidence needed to evaluate the condition.","ODRL Information Model 2.2 §2.6 Constraint Class; ODRL Vocabulary 2.2 §4.5 Left Operands"
"EL-ODRL-operator","STD-ODRL-2.2","2.2","INTERNATIONAL_STANDARD — W3C Recommendation","http://www.w3.org/ns/odrl/2/","odrl:operator","operator","Identifies the comparison operator used by an atomic constraint.","odrl:Constraint","odrl:Operator","1","ODRL operator vocabulary","NORMATIVE","NONE_IDENTIFIED","Express equality ordering inclusion or other comparison semantics.","Operator semantics do not define data acquisition trust or legal interpretation of operands.","ODRL Information Model 2.2 §2.6 Constraint Class; ODRL Vocabulary 2.2 §3.8 Operators"
"EL-ODRL-rightOperand","STD-ODRL-2.2","2.2","INTERNATIONAL_STANDARD — W3C Recommendation","http://www.w3.org/ns/odrl/2/","odrl:rightOperand","right operand","Supplies the value against which the left operand is compared in an atomic constraint.","odrl:Constraint","rdfs:Resource or rdfs:Literal","1","PROFILE_DEPENDENT","NORMATIVE","NONE_IDENTIFIED","Supply a purpose time recipient geography count or other constraint value.","Datatype unit vocabulary and authoritative value source must be profiled.","ODRL Information Model 2.2 §2.6 Constraint Class — rightOperand relation"
"EL-ODRL-hasPolicy","STD-ODRL-2.2","2.2","INTERNATIONAL_STANDARD — W3C Recommendation","http://www.w3.org/ns/odrl/2/","odrl:hasPolicy","has policy","Relates an asset to a policy governing it.","odrl:Asset","odrl:Policy","0..*","NOT_APPLICABLE","NORMATIVE","NONE_IDENTIFIED","Attach use and access policy to a dataset distribution or service asset.","The relation records an asserted policy and not governing authority legal effect or technical enforcement.","ODRL Vocabulary 2.2 §2.7 Policy Properties — odrl:hasPolicy"
"EL-SHACL-NodeShape","STD-SHACL-2017","2017 Recommendation","INTERNATIONAL_STANDARD — W3C Recommendation","http://www.w3.org/ns/shacl#","sh:NodeShape","Node Shape","A shape that validates focus nodes against node-level constraints.","NOT_APPLICABLE","NOT_APPLICABLE","NOT_APPLICABLE","NOT_APPLICABLE","NORMATIVE","https://w3c.github.io/data-shapes/data-shapes-test-suite/","Define constraints applying to dataset service policy measurement or evidence nodes.","Validation establishes only conformance to the selected shape under recorded assumptions.","SHACL Recommendation §2.1 Shapes — sh:NodeShape"
"EL-SHACL-PropertyShape","STD-SHACL-2017","2017 Recommendation","INTERNATIONAL_STANDARD — W3C Recommendation","http://www.w3.org/ns/shacl#","sh:PropertyShape","Property Shape","A shape with exactly one path that validates values reached from focus nodes along that path.","NOT_APPLICABLE","NOT_APPLICABLE","NOT_APPLICABLE","NOT_APPLICABLE","NORMATIVE","https://w3c.github.io/data-shapes/data-shapes-test-suite/","Define field-level cardinality datatype class value and logical constraints.","Property-shape success does not verify factual correctness of values.","SHACL Recommendation §2.1 Shapes — sh:PropertyShape"
"EL-SHACL-targetClass","STD-SHACL-2017","2017 Recommendation","INTERNATIONAL_STANDARD — W3C Recommendation","http://www.w3.org/ns/shacl#","sh:targetClass","target class","Targets as focus nodes the instances of a specified class under the selected entailment regime.","sh:Shape","rdfs:Class","0..*","NOT_APPLICABLE","NORMATIVE","https://w3c.github.io/data-shapes/data-shapes-test-suite/","Select which resource types a shape validates.","Target expansion can differ with entailment; the regime must be recorded.","SHACL Recommendation §2.1.3.1 Target Classes"
"EL-SHACL-path","STD-SHACL-2017","2017 Recommendation","INTERNATIONAL_STANDARD — W3C Recommendation","http://www.w3.org/ns/shacl#","sh:path","property path","Identifies the SHACL property path used to obtain value nodes from a focus node.","sh:PropertyShape","SHACL property path","1","NOT_APPLICABLE","NORMATIVE","https://w3c.github.io/data-shapes/data-shapes-test-suite/","Bind a property shape to the metadata field or path it validates.","Complex paths may reduce readability and do not define business semantics.","SHACL Recommendation §2.3.1 Property Paths"
"EL-SHACL-minCount","STD-SHACL-2017","2017 Recommendation","INTERNATIONAL_STANDARD — W3C Recommendation","http://www.w3.org/ns/shacl#","sh:minCount","minimum count","Requires at least the specified number of value nodes for each focus node.","sh:PropertyShape","xsd:integer","0..1","NOT_APPLICABLE","NORMATIVE","https://w3c.github.io/data-shapes/data-shapes-test-suite/","Validate mandatory metadata and minimum multiplicity.","A value's presence does not establish completeness substance or truth.","SHACL Recommendation §4.2.1 sh:minCount"
"EL-SHACL-maxCount","STD-SHACL-2017","2017 Recommendation","INTERNATIONAL_STANDARD — W3C Recommendation","http://www.w3.org/ns/shacl#","sh:maxCount","maximum count","Requires no more than the specified number of value nodes for each focus node.","sh:PropertyShape","xsd:integer","0..1","NOT_APPLICABLE","NORMATIVE","https://w3c.github.io/data-shapes/data-shapes-test-suite/","Validate maximum multiplicity and functional fields.","Duplicate semantics and identity still depend on RDF term equality and profile design.","SHACL Recommendation §4.2.2 sh:maxCount"
"EL-SHACL-class","STD-SHACL-2017","2017 Recommendation","INTERNATIONAL_STANDARD — W3C Recommendation","http://www.w3.org/ns/shacl#","sh:class","class constraint","Requires each value node to be a SHACL instance of the specified class.","sh:Shape","rdfs:Class","0..1","NOT_APPLICABLE","NORMATIVE","https://w3c.github.io/data-shapes/data-shapes-test-suite/","Validate object-resource class membership.","Results depend on the chosen entailment regime and cannot establish real-world category truth.","SHACL Recommendation §4.1.1 sh:class"
"EL-SHACL-datatype","STD-SHACL-2017","2017 Recommendation","INTERNATIONAL_STANDARD — W3C Recommendation","http://www.w3.org/ns/shacl#","sh:datatype","datatype constraint","Requires each value node to be a literal with the specified datatype.","sh:Shape","rdfs:Datatype","0..1","NOT_APPLICABLE","NORMATIVE","https://w3c.github.io/data-shapes/data-shapes-test-suite/","Validate dates booleans numeric counts and metric-value datatypes.","Correct datatype does not establish plausible value units method or factual accuracy.","SHACL Recommendation §4.1.2 sh:datatype"
"EL-SHACL-nodeKind","STD-SHACL-2017","2017 Recommendation","INTERNATIONAL_STANDARD — W3C Recommendation","http://www.w3.org/ns/shacl#","sh:nodeKind","node-kind constraint","Requires each value node to have the selected RDF node kind such as IRI literal or blank node.","sh:Shape","sh:NodeKind","0..1","sh:IRI|sh:Literal|sh:BlankNode and defined unions","NORMATIVE","https://w3c.github.io/data-shapes/data-shapes-test-suite/","Require persistent IRI references or literal values as appropriate.","IRI syntax does not ensure resolution persistence or authority.","SHACL Recommendation §4.1.3 sh:nodeKind"
"EL-SHACL-closed","STD-SHACL-2017","2017 Recommendation","INTERNATIONAL_STANDARD — W3C Recommendation","http://www.w3.org/ns/shacl#","sh:closed","closed shape","When true constrains a focus node to properties enumerated by its property shapes except explicitly ignored properties.","sh:NodeShape","xsd:boolean","0..1","NOT_APPLICABLE","NORMATIVE","https://w3c.github.io/data-shapes/data-shapes-test-suite/","Detect unexpected metadata properties in tightly governed exchange profiles.","Closed shapes can reject valid extensions and should not be used as a general legal completeness claim.","SHACL Recommendation §4.8.1 sh:closed"
"EL-SHACL-ValidationReport","STD-SHACL-2017","2017 Recommendation","INTERNATIONAL_STANDARD — W3C Recommendation","http://www.w3.org/ns/shacl#","sh:ValidationReport","Validation Report","The result graph root describing whether the data graph conforms and containing validation results.","NOT_APPLICABLE","NOT_APPLICABLE","NOT_APPLICABLE","NOT_APPLICABLE","NORMATIVE","https://w3c.github.io/data-shapes/data-shapes-test-suite/","Record reproducible technical-conformance output.","A report is specific to one data graph shapes graph entailment regime and processor execution.","SHACL Recommendation §3.6 Validation Report"
"EL-SHACL-conforms","STD-SHACL-2017","2017 Recommendation","INTERNATIONAL_STANDARD — W3C Recommendation","http://www.w3.org/ns/shacl#","sh:conforms","conforms","Boolean on the validation report indicating whether validation produced no results with severity sh:Violation.","sh:ValidationReport","xsd:boolean","1","NOT_APPLICABLE","NORMATIVE","https://w3c.github.io/data-shapes/data-shapes-test-suite/","State the binary result of the selected SHACL validation run.","Must never be presented as substantive legal compliance or factual truth.","SHACL Recommendation §3.6.1 Validation Report — sh:conforms"
"EL-SHACL-ValidationResult","STD-SHACL-2017","2017 Recommendation","INTERNATIONAL_STANDARD — W3C Recommendation","http://www.w3.org/ns/shacl#","sh:ValidationResult","Validation Result","A result node identifying a constraint failure and its focus node source and optional path value and message.","NOT_APPLICABLE","NOT_APPLICABLE","NOT_APPLICABLE","NOT_APPLICABLE","NORMATIVE","https://w3c.github.io/data-shapes/data-shapes-test-suite/","Record field-level validation evidence and actionable diagnostics.","A result identifies graph non-conformance under the selected shape rather than legal non-compliance.","SHACL Recommendation §3.6 Validation Report — validation results"
"EL-SHACL-result","STD-SHACL-2017","2017 Recommendation","INTERNATIONAL_STANDARD — W3C Recommendation","http://www.w3.org/ns/shacl#","sh:result","validation result link","Relates a validation report to one of its validation results.","sh:ValidationReport","sh:ValidationResult","0..*","NOT_APPLICABLE","NORMATIVE","https://w3c.github.io/data-shapes/data-shapes-test-suite/","Enumerate constraint failures in a validation report.","An empty result set is meaningful only with the matching shapes and run provenance.","SHACL Recommendation §3.6.1 Validation Report — sh:result"
"EL-SHACL-resultSeverity","STD-SHACL-2017","2017 Recommendation","INTERNATIONAL_STANDARD — W3C Recommendation","http://www.w3.org/ns/shacl#","sh:resultSeverity","result severity","Records the severity associated with the source shape of a validation result.","sh:ValidationResult","sh:Severity","1","sh:Violation|sh:Warning|sh:Info or profile extensions","NORMATIVE","https://w3c.github.io/data-shapes/data-shapes-test-suite/","Classify validation findings for processing and review.","Severity levels other than sh:Violation do not affect sh:conforms and do not encode legal materiality.","SHACL Recommendation §2.1.4 Severity and §3.6 Validation Report"
"EL-SHACL-focusNode","STD-SHACL-2017","2017 Recommendation","INTERNATIONAL_STANDARD — W3C Recommendation","http://www.w3.org/ns/shacl#","sh:focusNode","focus node","Identifies the focus node that failed a constraint.","sh:ValidationResult","rdfs:Resource","1","NOT_APPLICABLE","NORMATIVE","https://w3c.github.io/data-shapes/data-shapes-test-suite/","Trace a validation finding to the affected metadata resource.","Does not identify the responsible human or real-world object without additional provenance.","SHACL Recommendation §3.6.2 Validation Result — sh:focusNode"
"EL-SHACL-resultPath","STD-SHACL-2017","2017 Recommendation","INTERNATIONAL_STANDARD — W3C Recommendation","http://www.w3.org/ns/shacl#","sh:resultPath","result path","Identifies the path associated with the value nodes that caused a validation result when applicable.","sh:ValidationResult","SHACL property path","0..1","NOT_APPLICABLE","NORMATIVE","https://w3c.github.io/data-shapes/data-shapes-test-suite/","Trace a finding to the affected field or graph path.","Not every constraint has a result path and paths do not provide legal issue classification.","SHACL Recommendation §3.6.2 Validation Result — sh:resultPath"
"EL-MLDCATAP-Dataset-biasMethod","STD-MLDCATAP-3.1.0","3.1.0","EU_DRAFT — SEMIC Candidate Recommendation","http://data.europa.eu/it6/","it6:biasMethod","bias method","Describes methods used during acquisition or processing to address identifiable bias in training data.","dcat:Dataset","rdfs:Literal","0..*","NOT_APPLICABLE","NORMATIVE_DRAFT_PROFILE_ELEMENT","https://semiceu.github.io/MLDCAT-AP/releases/3.1.0/shacl/mldcat-ap-SHACL.ttl","Document methods intended to address training-data bias.","Optional free text records a claimed method but not bias examination results effectiveness residual bias representativeness or Article 10 compliance.","MLDCAT-AP 3.1.0 §Dataset — bias method row (it6:biasMethod)"
"EL-MLDCATAP-Dataset-collectionDate","STD-MLDCATAP-3.1.0","3.1.0","EU_DRAFT — SEMIC Candidate Recommendation","http://data.europa.eu/it6/","it6:collectionDate","collection date","The date the data was originally collected as supplied by the uploader.","dcat:Dataset","dct:temporal literal","1","NOT_APPLICABLE","NORMATIVE_DRAFT_PROFILE_CONSTRAINT","https://semiceu.github.io/MLDCAT-AP/releases/3.1.0/shacl/mldcat-ap-SHACL.ttl","Require an original collection date for an ML dataset.","A single date may not represent a collection interval refreshes or source-specific dates and uploader assertion is not independently verified.","MLDCAT-AP 3.1.0 §Dataset — collection date row (it6:collectionDate)"
"EL-MLDCATAP-Dataset-collectionMethod","STD-MLDCATAP-3.1.0","3.1.0","EU_DRAFT — SEMIC Candidate Recommendation","http://data.europa.eu/it6/","it6:collectionMethod","collection method","Describes the method used to collect the data as supplied by the uploader.","dcat:Dataset","rdfs:Literal","0..1","NOT_APPLICABLE","NORMATIVE_DRAFT_PROFILE_ELEMENT","https://semiceu.github.io/MLDCAT-AP/releases/3.1.0/shacl/mldcat-ap-SHACL.ttl","Document how dataset observations or records were collected.","Optional free text lacks structured sources sampling protocol uncertainty original purpose and independent verification.","MLDCAT-AP 3.1.0 §Dataset — collection method row (it6:collectionMethod)"
"EL-MLDCATAP-Dataset-curationMethod","STD-MLDCATAP-3.1.0","3.1.0","EU_DRAFT — SEMIC Candidate Recommendation","http://data.europa.eu/it6/","it6:curationMethod","curation method","Describes processing that transformed acquired data into training testing or validation data such as cleaning normalization or augmentation.","dcat:Dataset","rdfs:Literal","0..*","NOT_APPLICABLE","NORMATIVE_DRAFT_PROFILE_ELEMENT","https://semiceu.github.io/MLDCAT-AP/releases/3.1.0/shacl/mldcat-ap-SHACL.ttl","Document preparation and curation steps relevant to AI dataset governance.","Free text does not structurally distinguish annotation labeling cleaning updating enrichment aggregation parameters agents timestamps or outputs.","MLDCAT-AP 3.1.0 §Dataset — curation method row (it6:curationMethod)"
"EL-MLDCATAP-Dataset-dataProvenance","STD-MLDCATAP-3.1.0","3.1.0","EU_DRAFT — SEMIC Candidate Recommendation","http://data.europa.eu/it6/","it6:dataProvenance","data provenance","A documented trail accounting for the origin of data.","dcat:Dataset","rdfs:Literal","0..*","NOT_APPLICABLE","NORMATIVE_DRAFT_PROFILE_ELEMENT","https://semiceu.github.io/MLDCAT-AP/releases/3.1.0/shacl/mldcat-ap-SHACL.ttl","Record a narrative account of dataset origin.","Literal provenance is not structured lineage and does not ensure completeness authority or evidence integrity; PROV-O links remain necessary.","MLDCAT-AP 3.1.0 §Dataset — data provenance row (it6:dataProvenance)"
"EL-MLDCATAP-Dataset-unsuitabilityMethod","STD-MLDCATAP-3.1.0","3.1.0","EU_DRAFT — SEMIC Candidate Recommendation","http://data.europa.eu/it6/","it6:unsuitabilityMethod","unsuitability method","Describes methods used during acquisition or processing to detect unsuitable data sources in light of intended model uses.","dcat:Dataset","rdfs:Literal","0..*","NOT_APPLICABLE","NORMATIVE_DRAFT_PROFILE_ELEMENT","https://semiceu.github.io/MLDCAT-AP/releases/3.1.0/shacl/mldcat-ap-SHACL.ttl","Document screening methods for illegal inappropriate or otherwise unsuitable source data.","Optional free text does not record screening results decisions remedies legal tests or ongoing monitoring.","MLDCAT-AP 3.1.0 §Dataset — unsuitability method row (it6:unsuitabilityMethod)"
"EL-MLDCATAP-Distribution-hasFeature","STD-MLDCATAP-3.1.0","3.1.0","EU_DRAFT — SEMIC Candidate Recommendation","http://data.europa.eu/it6/","it6:hasFeature","has feature","Relates a distribution to an attribute or column that forms part of it.","dcat:Distribution","it6:Feature","0..*","NOT_APPLICABLE","NORMATIVE_DRAFT_PROFILE_ELEMENT","https://semiceu.github.io/MLDCAT-AP/releases/3.1.0/shacl/mldcat-ap-SHACL.ttl","Describe distribution-level features or columns used for training testing or validation.","Optional feature declarations do not establish full schema coverage or semantic correctness.","MLDCAT-AP 3.1.0 §Distribution — has feature row (it6:hasFeature)"
"EL-MLDCATAP-Feature","STD-MLDCATAP-3.1.0","3.1.0","EU_DRAFT — SEMIC Candidate Recommendation","http://data.europa.eu/it6/","it6:Feature","Feature","An attribute or column associated with an ML dataset distribution and described by mandatory title and type properties.","NOT_APPLICABLE","NOT_APPLICABLE","NOT_APPLICABLE","NOT_APPLICABLE","NORMATIVE_DRAFT_PROFILE_ELEMENT","https://semiceu.github.io/MLDCAT-AP/releases/3.1.0/shacl/mldcat-ap-SHACL.ttl","Represent model-relevant dataset attributes as identifiable resources.","The profile does not ensure every variable is declared or capture all statistical semantic privacy and quality characteristics.","MLDCAT-AP 3.1.0 §Feature"
"EL-MLDCATAP-Feature-title","STD-MLDCATAP-3.1.0","3.1.0","EU_DRAFT — SEMIC Candidate Recommendation","http://purl.org/dc/terms/","dct:title","Feature title","A mandatory name for the feature.","it6:Feature","rdfs:Literal","1..*","NOT_APPLICABLE","NORMATIVE_DRAFT_PROFILE_CONSTRAINT","https://semiceu.github.io/MLDCAT-AP/releases/3.1.0/shacl/mldcat-ap-SHACL.ttl","Provide a human-readable feature identifier.","A label does not define semantics datatype provenance or measurement scale.","MLDCAT-AP 3.1.0 §Feature — title row (dct:title)"
"EL-MLDCATAP-Feature-type","STD-MLDCATAP-3.1.0","3.1.0","EU_DRAFT — SEMIC Candidate Recommendation","http://purl.org/dc/terms/","dct:type","Feature type","A mandatory classification of the feature.","it6:Feature","rdfs:Resource","1..*","PROFILE_DEPENDENT","NORMATIVE_DRAFT_PROFILE_CONSTRAINT","https://semiceu.github.io/MLDCAT-AP/releases/3.1.0/shacl/mldcat-ap-SHACL.ttl","Classify a dataset feature for machine-learning use.","The profile does not supply a complete legally relevant feature taxonomy or prove correct classification.","MLDCAT-AP 3.1.0 §Feature — type row (dct:type)"
"EL-MLDCATAP-Distribution-hasQualityMeasurement","STD-MLDCATAP-3.1.0","3.1.0","EU_DRAFT — SEMIC Candidate Recommendation","http://www.w3.org/ns/dqv#","dqv:hasQualityMeasurement","has quality measurement","Relates each distribution to one or more quality measurements.","dcat:Distribution","dqv:QualityMeasurement","1..*","NOT_APPLICABLE","NORMATIVE_DRAFT_PROFILE_CONSTRAINT","https://semiceu.github.io/MLDCAT-AP/releases/3.1.0/shacl/mldcat-ap-SHACL.ttl","Require at least one quality measurement on each ML dataset distribution.","The profile does not ensure coverage of legally relevant dimensions define measurement methods or establish substantive sufficiency.","MLDCAT-AP 3.1.0 §Distribution — has quality measurement row (dqv:hasQualityMeasurement)"
"EL-MLDCATAP-Distribution-numberOfDatapoints","STD-MLDCATAP-3.1.0","3.1.0","EU_DRAFT — SEMIC Candidate Recommendation","http://data.europa.eu/it6/","it6:numberOfDatapoints","number of datapoints","The total count of individual data entries or observations in the distribution.","dcat:Distribution","xsd:nonNegativeInteger","0..1","NOT_APPLICABLE","NORMATIVE_DRAFT_PROFILE_ELEMENT","https://semiceu.github.io/MLDCAT-AP/releases/3.1.0/shacl/mldcat-ap-SHACL.ttl","Record distribution size for quantity and coverage review.","Optional count lacks a counting method snapshot time uncertainty or record-level evidence.","MLDCAT-AP 3.1.0 §Distribution — number of datapoints row (it6:numberOfDatapoints)"
"EL-MLDCATAP-MachineLearningModel-trainedOn","STD-MLDCATAP-3.1.0","3.1.0","EU_DRAFT — SEMIC Candidate Recommendation","http://data.europa.eu/it6/","it6:trainedOn","trained on","Relates a machine-learning model to each dataset used to train it.","it6:MachineLearningModel","dcat:Dataset","1..*","NOT_APPLICABLE","NORMATIVE_DRAFT_PROFILE_CONSTRAINT","https://semiceu.github.io/MLDCAT-AP/releases/3.1.0/shacl/mldcat-ap-SHACL.ttl","Trace a model to mandatory training-dataset references.","Does not identify exact distribution split version sampling run or whether the dataset was lawfully and suitably used.","MLDCAT-AP 3.1.0 §Machine Learning Model — trained on row (it6:trainedOn)"
"EL-MLDCATAP-QualityMeasurement-type","STD-MLDCATAP-3.1.0","3.1.0","EU_DRAFT — SEMIC Candidate Recommendation","http://purl.org/dc/terms/","dct:type","quality classification","A mandatory classification for the quality represented by the measurement.","dqv:QualityMeasurement","it6:DataQuality","1","PROFILE_DEPENDENT","NORMATIVE_DRAFT_PROFILE_CONSTRAINT","https://semiceu.github.io/MLDCAT-AP/releases/3.1.0/shacl/mldcat-ap-SHACL.ttl","Classify a distribution quality result.","This differs from canonical DQV's explicit dqv:isMeasurementOf Metric and inDimension pattern and may need a profile bridge.","MLDCAT-AP 3.1.0 §Quality Measurement — type row (dct:type)"
"EL-MLDCATAP-QualityMeasurement-value","STD-MLDCATAP-3.1.0","3.1.0","EU_DRAFT — SEMIC Candidate Recommendation","http://www.w3.org/ns/dqv#","dqv:value","quality value","A mandatory value for the quality measurement.","dqv:QualityMeasurement","rdfs:Literal","1","PROFILE_DEPENDENT","NORMATIVE_DRAFT_PROFILE_CONSTRAINT","https://semiceu.github.io/MLDCAT-AP/releases/3.1.0/shacl/mldcat-ap-SHACL.ttl","Require an observed value for each ML quality measurement.","No datatype unit formula method uncertainty threshold provenance or evaluation time is mandatory in this profile row.","MLDCAT-AP 3.1.0 §Quality Measurement — value row (dqv:value)"
"EL-CROISSANT-Dataset","STD-CROISSANT-1.1","1.1","COMMUNITY_SPEC — MLCommons specification","http://schema.org/","schema:Dataset","Dataset","A Croissant description must type its top-level resource as schema.org Dataset and provide the required dataset-level fields.","NOT_APPLICABLE","NOT_APPLICABLE","NOT_APPLICABLE","NOT_APPLICABLE","NORMATIVE","REFERENCE_IMPLEMENTATION_VALIDATOR; no normative SHACL identified","Represent the top-level ML-ready dataset description.","Schema-level typing does not establish dataset identity ownership source authority or legal scope.","Croissant 1.1 §Dataset-level Information — schema.org/Dataset required fields"
"EL-CROISSANT-Dataset-conformsTo","STD-CROISSANT-1.1","1.1","COMMUNITY_SPEC — MLCommons specification","http://purl.org/dc/terms/","dct:conformsTo","conforms to Croissant version","A Croissant dataset must declare conformance to the versioned specification IRI.","schema:Dataset","schema:URL","1..*","http://mlcommons.org/croissant/1.1","NORMATIVE","REFERENCE_IMPLEMENTATION_VALIDATOR; no normative SHACL identified","Pin the dataset metadata record to Croissant 1.1.","A declaration is not proof of conformance or legal compliance and multiple specification IRIs may be present.","Croissant 1.1 §Namespaces and §Dataset-level Information required properties — dct:conformsTo"
